{
  "contribution": {
    "agent": "Claude (Cowork)",
    "model": "Claude Opus 5 (claude-opus-5)",
    "start": "2026-08-03 04:13 UTC",
    "end": "2026-08-03 04:13 UTC",
    "procedure": "Director contribution-tagging procedure (docs/decisions/0006)."
  },
  "$comment": "ROADMAP Phase 1A step 5 - collision truth. Engine-neutral canon (Rule 22 / Decision 0002). This is the layer Rule 13 exists to protect: visible action and authoritative result must agree. Definitions only - no engine implementation is claimed (Rule 18). Every number is a tuning hypothesis. Semantics: docs/phase1a/collision_truth.md.",
  "schema_version": "0.1.0-draft",
  "tuning_status": "hypothesis",
  "determinism": {
    "$comment": "Collision is where nondeterminism would be easiest to introduce and hardest to see.",
    "swept_volumes": true,
    "simultaneity": "pre_tick_snapshot",
    "pair_ordering": "ascending_actor_index_then_move_id",
    "timing_source": "authoritative_tick"
  },
  "volumes": {
    "hitboxes": [
      { "id": "glove_lead", "attached_to": "lead_glove", "active_source": "move_active_frames" },
      { "id": "glove_rear", "attached_to": "rear_glove", "active_source": "move_active_frames" },
      { "id": "forearm_lead", "attached_to": "lead_forearm", "active_source": "move_active_frames", "notes": "Inside work and clinch contact; never a substitute for a glove landing." },
      { "id": "forearm_rear", "attached_to": "rear_forearm", "active_source": "move_active_frames" }
    ],
    "hurtboxes": [
      { "id": "hb_head", "condition_region": "head", "height_class": "high", "side": "center" },
      { "id": "hb_jaw", "condition_region": "jaw_chin", "height_class": "high", "side": "center", "notes": "The knockdown-relevant region; Chin scales resistance here but never confers immunity (Rule 14)." },
      { "id": "hb_eye_left", "condition_region": "eye_left", "height_class": "high", "side": "left", "notes": "Side-specific by construction - eye damage must be visibly attributable to the side that took it." },
      { "id": "hb_eye_right", "condition_region": "eye_right", "height_class": "high", "side": "right" },
      { "id": "hb_torso_upper", "condition_region": "torso_upper", "height_class": "low", "side": "center" },
      { "id": "hb_torso_lower", "condition_region": "torso_lower", "height_class": "low", "side": "center" },
      { "id": "hb_arm_left", "condition_region": "arm_left", "height_class": "high", "side": "left", "notes": "Arms are hurtboxes in their own right: intelligent varied pressure damages them and degrades guard structure (Rule 14)." },
      { "id": "hb_arm_right", "condition_region": "arm_right", "height_class": "high", "side": "right" }
    ],
    "guard_volumes": [
      {
        "id": "guard_high",
        "height_class": "high",
        "covers_regions": ["head", "jaw_chin", "eye_left", "eye_right"],
        "absorbs_into": ["arm_left", "arm_right", "guard_integrity", "stamina"],
        "notes": "Covers the head cluster only. A high guard does not protect the body - that is the counterplay against passive high blocking (Rule 4)."
      },
      {
        "id": "guard_body",
        "height_class": "low",
        "covers_regions": ["torso_upper", "torso_lower"],
        "absorbs_into": ["arm_left", "arm_right", "guard_integrity", "stamina"],
        "notes": "Elbows and forearms down. Leaves the head cluster exposed - the mirror trade-off."
      }
    ]
  },
  "guard_interception": {
    "$comment": "Which guard VOLUMES intercept each move.schema.json guard_interaction value. Interception follows the punch's PATH, not its target region - this is the correction the validator forced on 2026-08-03. An uppercut lands on the jaw (a high region) yet is authored blockable_low, because it travels upward into the guard: a dropped forearm stops it and a high shell does not. That is precisely why the uppercut punishes a high guard, and why the high/low guard choice is a real trade-off rather than a label.",
    "blockable_high": ["guard_high"],
    "blockable_low": ["guard_body"],
    "blockable_either": ["guard_high", "guard_body"]
  },
  "resolution_pipeline": [
    {
      "order": 0,
      "id": "sweep_overlap",
      "question": "Did the attack's swept hitbox intersect ANY hurtbox or guard volume of the opponent during its active window?",
      "verdict_if_true": "whiffed",
      "on_false": "terminal",
      "reads": ["hitbox_swept_path", "opponent_hurtboxes", "opponent_guard_volumes"],
      "notes": "INVERTED STAGE: the verdict fires when the answer is NO. Recorded explicitly so the pipeline stays total. Empty space is the greatest commitment consequence (Rule 13) and the simulation never nudges distance to avoid it - a wrong-range punch whiffs (no magnetic correction)."
    },
    {
      "order": 1,
      "id": "active_evasion",
      "question": "Was the defender inside an authored evasion active window that vacated the intersected region before contact?",
      "verdict_if_true": "dodged",
      "on_false": "guard_intercept",
      "reads": ["defender_move_active_frames", "hurtbox_swept_path"],
      "notes": "Ranked above guard deliberately: an active slip that also passed near the guard is a dodge, and dodged punishes commitment more than blocked (Rule 13 tier order). Rewarding the active defensive choice over the passive one is the point."
    },
    {
      "order": 2,
      "id": "guard_intercept",
      "question": "Did a guard volume covering that region intercept first along the sweep, and does the move's guard_interaction permit blocking at that height?",
      "verdict_if_true": "blocked",
      "on_false": "dispatch_quality",
      "reads": ["guard_volumes", "move_guard_interaction", "hitbox_swept_path"],
      "notes": "'First along the sweep' is what makes a guard a physical object rather than a status flag. Blocked force still absorbs into arms and guard structure - blocking reduces clean damage without erasing consequence (Rule 14)."
    },
    {
      "order": 3,
      "id": "dispatch_quality",
      "question": "Contact reached a hurtbox: how well aligned was it?",
      "verdict_if_true": "dispatch_quality_bands",
      "on_false": "terminal",
      "reads": ["contact_alignment", "contact_normal", "closing_velocity"],
      "notes": "Terminal dispatch into exactly one of the four landed classes. Grazed and brushed remain meaningful damage, not free hits (Rule 14)."
    }
  ],
  "quality_bands": [
    { "class": "brushed", "min_alignment": 0.0, "max_alignment": 0.35, "delivered_force_fraction": 0.15, "notes": "Glancing contact; reduced but potentially meaningful." },
    { "class": "grazed", "min_alignment": 0.35, "max_alignment": 0.6, "delivered_force_fraction": 0.4 },
    { "class": "solid", "min_alignment": 0.6, "max_alignment": 0.85, "delivered_force_fraction": 0.75 },
    { "class": "clean", "min_alignment": 0.85, "max_alignment": 1.0, "delivered_force_fraction": 1.0, "notes": "Full authored force. A visible miss can never arrive here - the sweep stage already terminated it (Rule 13)." }
  ],
  "closing_velocity": {
    "$comment": "Rule 14: movement into a punch may increase consequence; movement away may reduce it. Bounded so it modulates rather than dominates contact quality.",
    "into_punch_max_multiplier": 1.35,
    "away_from_punch_min_multiplier": 0.7,
    "neutral_multiplier": 1.0
  },
  "prohibitions": [
    "Classify a visible miss as a clean hit, or any landed class (Rule 13).",
    "Apply magnetic range correction, hitbox inflation, or target snapping to make an attempt connect.",
    "Resolve contact by discrete per-tick sampling; a fast punch must not tunnel through a hurtbox between ticks.",
    "Replace per-region hurtboxes with a single generic health volume (Rule 14).",
    "Grant an unblockable-by-design attack; move.schema.json marks that value prohibited (Rule 11).",
    "Award a guard break to predictable single-action spam rather than to intelligent varied pressure (Rule 14).",
    "Apply a flat random knockout roll at the moment of contact (Rule 14).",
    "Let iteration order, container layout, frame rate or wall-clock time affect any classification."
  ],
  "invariants": [
    { "id": "pipeline_total", "rule": "Criterion A.5", "statement": "The pipeline is a total ordered function: every attack resolves to exactly one of the seven contact classes, and every class is reachable.", "enforced_by": "tools/uppercut_validate/collision.py::check_pipeline_total" },
    { "id": "no_miss_as_hit", "rule": "Rule 13", "statement": "Non-intersection terminates at whiffed before any landed class can be considered; a visible miss can never be classified as a clean hit.", "enforced_by": "pipeline order + check_pipeline_total" },
    { "id": "region_lock", "rule": "Rule 14", "statement": "Every hurtbox maps to a declared condition region, and every physically strikeable region has a hurtbox. No generic health volume exists.", "enforced_by": "tools/uppercut_validate/collision.py::check_region_lock" },
    { "id": "guard_is_physical", "rule": "Rule 13", "statement": "A block requires a guard volume covering the struck region to intercept first along the swept path; guard is an object in space, not a status flag.", "enforced_by": "pipeline stage guard_intercept + check_guard_coverage" },
    { "id": "guard_costs_something", "rule": "Rule 14", "statement": "Every guard volume absorbs into arms and guard integrity; blocking reduces clean damage without erasing consequence.", "enforced_by": "tools/uppercut_validate/collision.py::check_guard_coverage" },
    { "id": "commitment_order_holds", "rule": "Rule 13", "statement": "The classes this pipeline emits are exactly the seven of data/contact_classes.json, whose commitment consequence strictly increases blocked -> dodged -> whiffed.", "enforced_by": "tools/uppercut_validate/collision.py::check_contact_classes" },